{
  "schema_version": "1.1.1",
  "id": "BUS-DATASET-001",
  "version": "1.1.0",
  "review_status": "approved",
  "source": {
    "kind": "mock_business_seed",
    "description": "全部记录均为虚构；不包含真实客户信息，也不代表业务服务返回结果。"
  },
  "shop": {
    "id": "SHOP-DEMO-001",
    "version": "1.0.0",
    "name": "青屿示例店",
    "currency": "CNY",
    "timezone": "Asia/Shanghai",
    "category_ids": [
      "apparel_footwear",
      "digital_accessories",
      "customized"
    ]
  },
  "customers": [
    {
      "id": "CUST-001",
      "version": "1.0.0",
      "shop_id": "SHOP-DEMO-001",
      "display_name": "模拟客户甲"
    },
    {
      "id": "CUST-002",
      "version": "1.0.0",
      "shop_id": "SHOP-DEMO-001",
      "display_name": "模拟客户乙"
    }
  ],
  "products": [
    {
      "id": "PROD-APP-001",
      "version": "1.0.0",
      "shop_id": "SHOP-DEMO-001",
      "name": "青屿帆布鞋",
      "category_id": "apparel_footwear",
      "is_gift": false
    },
    {
      "id": "PROD-APP-002",
      "version": "1.0.0",
      "shop_id": "SHOP-DEMO-001",
      "name": "青屿轻薄外套",
      "category_id": "apparel_footwear",
      "is_gift": false
    },
    {
      "id": "PROD-DIG-001",
      "version": "1.0.0",
      "shop_id": "SHOP-DEMO-001",
      "name": "青屿蓝牙耳机",
      "category_id": "digital_accessories",
      "is_gift": false
    },
    {
      "id": "PROD-DIG-002",
      "version": "1.0.0",
      "shop_id": "SHOP-DEMO-001",
      "name": "青屿手机壳",
      "category_id": "digital_accessories",
      "is_gift": false
    },
    {
      "id": "PROD-DIG-003",
      "version": "1.0.0",
      "shop_id": "SHOP-DEMO-001",
      "name": "青屿充电器",
      "category_id": "digital_accessories",
      "is_gift": false
    },
    {
      "id": "PROD-CUS-001",
      "version": "1.0.0",
      "shop_id": "SHOP-DEMO-001",
      "name": "青屿刻字杯",
      "category_id": "customized",
      "is_gift": false
    },
    {
      "id": "PROD-GIFT-001",
      "version": "1.0.0",
      "shop_id": "SHOP-DEMO-001",
      "name": "青屿赠品擦拭布",
      "category_id": "digital_accessories",
      "is_gift": true
    }
  ],
  "campaigns": [
    {
      "id": "CAMPAIGN-COUPON-001",
      "version": "1.0.0",
      "shop_id": "SHOP-DEMO-001",
      "kind": "order_coupon",
      "title": "模拟订单优惠",
      "applicability": {
        "category_ids": [
          "apparel_footwear",
          "digital_accessories",
          "customized"
        ],
        "conditions": []
      },
      "effective_from": "2026-01-01T00:00:00+08:00",
      "effective_until": null,
      "evidence_refs": [
        {
          "kind": "policy_rule",
          "id": "RULE-PRO-001",
          "version": "1.0.0"
        },
        {
          "kind": "policy_rule",
          "id": "RULE-PRO-002",
          "version": "1.0.0"
        }
      ]
    },
    {
      "id": "CAMPAIGN-GIFT-001",
      "version": "1.0.0",
      "shop_id": "SHOP-DEMO-001",
      "kind": "gift_with_qualifying_line",
      "title": "模拟外套随单赠品",
      "applicability": {
        "category_ids": [
          "apparel_footwear"
        ],
        "conditions": [
          {
            "field": "product_id",
            "op": "eq",
            "value": "PROD-APP-002"
          }
        ]
      },
      "effective_from": "2026-01-01T00:00:00+08:00",
      "effective_until": null,
      "evidence_refs": [
        {
          "kind": "policy_rule",
          "id": "RULE-PRO-003",
          "version": "1.0.0"
        }
      ]
    }
  ],
  "orders": [
    {
      "id": "ORD-001",
      "version": "1.0.0",
      "shop_id": "SHOP-DEMO-001",
      "customer_id": "CUST-001",
      "purchased_at": "2026-10-01T10:00:00+08:00",
      "status": "delivered",
      "currency": "CNY",
      "line_ids": [
        "LINE-001-01"
      ],
      "payment_id": "PAY-001",
      "campaign_ids": [],
      "merchandise_gross_cents": 29900,
      "item_discount_total_cents": 0,
      "coupon_total_cents": 0,
      "merchandise_paid_cents": 29900,
      "outbound_shipping_paid_cents": 0,
      "total_paid_cents": 29900,
      "observed_at": "2026-10-09T10:00:00+08:00",
      "evidence_refs": [
        {
          "kind": "policy_rule",
          "id": "RULE-SHIP-001",
          "version": "1.1.0"
        },
        {
          "kind": "policy_rule",
          "id": "RULE-PRO-001",
          "version": "1.0.0"
        }
      ]
    },
    {
      "id": "ORD-002",
      "version": "1.0.0",
      "shop_id": "SHOP-DEMO-001",
      "customer_id": "CUST-001",
      "purchased_at": "2026-10-01T10:00:00+08:00",
      "status": "delivered",
      "currency": "CNY",
      "line_ids": [
        "LINE-002-01"
      ],
      "payment_id": "PAY-002",
      "campaign_ids": [],
      "merchandise_gross_cents": 29900,
      "item_discount_total_cents": 0,
      "coupon_total_cents": 0,
      "merchandise_paid_cents": 29900,
      "outbound_shipping_paid_cents": 0,
      "total_paid_cents": 29900,
      "observed_at": "2026-10-09T10:00:00+08:00",
      "evidence_refs": [
        {
          "kind": "policy_rule",
          "id": "RULE-SHIP-001",
          "version": "1.1.0"
        },
        {
          "kind": "policy_rule",
          "id": "RULE-PRO-001",
          "version": "1.0.0"
        }
      ]
    },
    {
      "id": "ORD-003",
      "version": "1.0.0",
      "shop_id": "SHOP-DEMO-001",
      "customer_id": "CUST-001",
      "purchased_at": "2026-10-01T10:00:00+08:00",
      "status": "delivered",
      "currency": "CNY",
      "line_ids": [
        "LINE-003-01"
      ],
      "payment_id": "PAY-003",
      "campaign_ids": [],
      "merchandise_gross_cents": 12900,
      "item_discount_total_cents": 0,
      "coupon_total_cents": 0,
      "merchandise_paid_cents": 12900,
      "outbound_shipping_paid_cents": 800,
      "total_paid_cents": 13700,
      "observed_at": "2026-10-09T10:00:00+08:00",
      "evidence_refs": [
        {
          "kind": "policy_rule",
          "id": "RULE-SHIP-001",
          "version": "1.1.0"
        },
        {
          "kind": "policy_rule",
          "id": "RULE-PRO-001",
          "version": "1.0.0"
        }
      ]
    },
    {
      "id": "ORD-004",
      "version": "1.0.0",
      "shop_id": "SHOP-DEMO-001",
      "customer_id": "CUST-001",
      "purchased_at": "2026-10-01T10:00:00+08:00",
      "status": "delivered",
      "currency": "CNY",
      "line_ids": [
        "LINE-004-01"
      ],
      "payment_id": "PAY-004",
      "campaign_ids": [],
      "merchandise_gross_cents": 19900,
      "item_discount_total_cents": 0,
      "coupon_total_cents": 0,
      "merchandise_paid_cents": 19900,
      "outbound_shipping_paid_cents": 0,
      "total_paid_cents": 19900,
      "observed_at": "2026-10-09T10:00:00+08:00",
      "evidence_refs": [
        {
          "kind": "policy_rule",
          "id": "RULE-SHIP-001",
          "version": "1.1.0"
        },
        {
          "kind": "policy_rule",
          "id": "RULE-PRO-001",
          "version": "1.0.0"
        }
      ]
    },
    {
      "id": "ORD-005",
      "version": "1.0.0",
      "shop_id": "SHOP-DEMO-001",
      "customer_id": "CUST-001",
      "purchased_at": "2026-10-01T10:00:00+08:00",
      "status": "delivered",
      "currency": "CNY",
      "line_ids": [
        "LINE-005-01"
      ],
      "payment_id": "PAY-005",
      "campaign_ids": [],
      "merchandise_gross_cents": 5990,
      "item_discount_total_cents": 0,
      "coupon_total_cents": 0,
      "merchandise_paid_cents": 5990,
      "outbound_shipping_paid_cents": 800,
      "total_paid_cents": 6790,
      "observed_at": "2026-10-09T10:00:00+08:00",
      "evidence_refs": [
        {
          "kind": "policy_rule",
          "id": "RULE-SHIP-001",
          "version": "1.1.0"
        },
        {
          "kind": "policy_rule",
          "id": "RULE-PRO-001",
          "version": "1.0.0"
        }
      ]
    },
    {
      "id": "ORD-006",
      "version": "1.0.0",
      "shop_id": "SHOP-DEMO-001",
      "customer_id": "CUST-001",
      "purchased_at": "2026-10-01T10:00:00+08:00",
      "status": "delivered",
      "currency": "CNY",
      "line_ids": [
        "LINE-006-01",
        "LINE-006-02",
        "LINE-006-03"
      ],
      "payment_id": "PAY-006",
      "campaign_ids": [
        "CAMPAIGN-COUPON-001",
        "CAMPAIGN-GIFT-001"
      ],
      "merchandise_gross_cents": 27800,
      "item_discount_total_cents": 2000,
      "coupon_total_cents": 3000,
      "merchandise_paid_cents": 22800,
      "outbound_shipping_paid_cents": 0,
      "total_paid_cents": 22800,
      "observed_at": "2026-10-09T10:00:00+08:00",
      "evidence_refs": [
        {
          "kind": "policy_rule",
          "id": "RULE-SHIP-001",
          "version": "1.1.0"
        },
        {
          "kind": "policy_rule",
          "id": "RULE-PRO-001",
          "version": "1.0.0"
        }
      ]
    },
    {
      "id": "ORD-007",
      "version": "1.0.0",
      "shop_id": "SHOP-DEMO-001",
      "customer_id": "CUST-001",
      "purchased_at": "2026-10-01T10:00:00+08:00",
      "status": "delivered",
      "currency": "CNY",
      "line_ids": [
        "LINE-007-01"
      ],
      "payment_id": "PAY-007",
      "campaign_ids": [
        "CAMPAIGN-COUPON-001"
      ],
      "merchandise_gross_cents": 9999,
      "item_discount_total_cents": 0,
      "coupon_total_cents": 1000,
      "merchandise_paid_cents": 8999,
      "outbound_shipping_paid_cents": 800,
      "total_paid_cents": 9799,
      "observed_at": "2026-10-09T10:00:00+08:00",
      "evidence_refs": [
        {
          "kind": "policy_rule",
          "id": "RULE-SHIP-001",
          "version": "1.1.0"
        },
        {
          "kind": "policy_rule",
          "id": "RULE-PRO-001",
          "version": "1.0.0"
        }
      ]
    },
    {
      "id": "ORD-008",
      "version": "1.0.0",
      "shop_id": "SHOP-DEMO-001",
      "customer_id": "CUST-001",
      "purchased_at": "2026-06-30T10:00:00+08:00",
      "status": "delivered",
      "currency": "CNY",